{
  "$schema": "./backlog-editoriale.schema.json",
  "schema_version": "1.0",
  "updated_at": "2026-09-28",
  "selection_policy": {
    "required_status": "ready",
    "automation_eligible": true,
    "dependencies_must_have_status": "pushed_to_main",
    "order_by": [
      "priority_ascending",
      "sequence_ascending"
    ],
    "maximum_items_per_run": 1,
    "when_no_item_matches": "stop_without_changes"
  },
  "items": [
    {
      "id": "METH-0001",
      "content_type": "methodology",
      "status": "pushed_to_main",
      "execution_mode": "manual_prerequisite",
      "automation_eligible": false,
      "sequence": 0,
      "priority": "P0",
      "slug": "/metodologia",
      "working_title": "Metodologia del simulatore FIRE",
      "cluster": "metodologia",
      "parent_id": null,
      "search_intent": "Capire formule, ipotesi, fiscalità semplificata e limiti del simulatore.",
      "primary_query": "come funziona il simulatore FIRE",
      "secondary_queries": [
        "formule calcolo FIRE",
        "ipotesi simulatore FIRE",
        "limiti calcolatore FIRE"
      ],
      "reader_outcome": "Il lettore può verificare come vengono prodotti i risultati e decidere se le ipotesi sono adatte al proprio scenario.",
      "unique_value": "Documentazione diretta e riproducibile del motore realmente utilizzato dal sito.",
      "simulator_features": [
        "FINITE",
        "SWR",
        "PAC",
        "fiscalità semplificata",
        "risorse aggiuntive"
      ],
      "source_focus": [
        "specifica matematica interna",
        "specifica fiscale interna",
        "implementazione e test del motore"
      ],
      "risk_level": "high",
      "freshness": "high",
      "dependencies": [],
      "notes": "Pagina metodologica completata, validata e inclusa nel rilascio editoriale destinato a origin/main."
    },
    {
      "id": "GUIDE-0001",
      "content_type": "guide",
      "status": "pushed_to_main",
      "execution_mode": "manual_pilot",
      "automation_eligible": false,
      "sequence": 1,
      "priority": "P0",
      "slug": "/guida/fire-italia",
      "working_title": "FIRE in Italia: guida all'indipendenza finanziaria",
      "cluster": "fondamenti-fire",
      "parent_id": null,
      "search_intent": "Comprendere che cos'è il FIRE e come adattarne il percorso al contesto italiano.",
      "primary_query": "FIRE Italia",
      "secondary_queries": [
        "indipendenza finanziaria Italia",
        "movimento FIRE Italia",
        "come raggiungere il FIRE"
      ],
      "reader_outcome": "Il lettore comprende obiettivo, fasi, variabili, rischi e ruolo del simulatore nel proprio percorso.",
      "unique_value": "Guida pilastro collegata a un simulatore italiano con ipotesi esplicite, fiscalità e risorse future.",
      "simulator_features": [
        "obiettivo FIRE",
        "PAC",
        "inflazione",
        "fiscalità",
        "risorse aggiuntive"
      ],
      "source_focus": [
        "fonti istituzionali italiane",
        "letteratura sull'indipendenza finanziaria",
        "metodologia del simulatore"
      ],
      "risk_level": "medium",
      "freshness": "medium",
      "dependencies": [
        "METH-0001"
      ],
      "notes": "Guida pilota completata e validata manualmente; il processo risultante è pronto per le esecuzioni automatiche."
    },
    {
      "id": "GUIDE-0002",
      "content_type": "guide",
      "status": "pushed_to_main",
      "execution_mode": "automatic",
      "automation_eligible": true,
      "sequence": 2,
      "priority": "P1",
      "slug": "/guida/numero-fire",
      "working_title": "Numero FIRE: quanto capitale serve per vivere di rendita",
      "cluster": "calcolo-fire",
      "parent_id": "GUIDE-0001",
      "search_intent": "Calcolare il patrimonio necessario a sostenere una spesa desiderata.",
      "primary_query": "quanto capitale serve per vivere di rendita",
      "secondary_queries": [
        "numero FIRE",
        "calcolo capitale FIRE",
        "quanti soldi servono per smettere di lavorare"
      ],
      "reader_outcome": "Il lettore sa trasformare le proprie spese in un intervallo di capitale e riconosce le ipotesi che lo modificano.",
      "unique_value": "Confronto tra target a durata finita e target SWR, con inflazione e imposte del simulatore.",
      "simulator_features": [
        "target FIRE",
        "FINITE",
        "SWR",
        "spesa mensile"
      ],
      "source_focus": [
        "metodologia del simulatore",
        "letteratura sui prelievi",
        "fonti italiane su fiscalità e inflazione"
      ],
      "risk_level": "medium",
      "freshness": "medium",
      "dependencies": [
        "METH-0001",
        "GUIDE-0001"
      ],
      "notes": null
    },
    {
      "id": "GUIDE-0003",
      "content_type": "guide",
      "status": "pushed_to_main",
      "execution_mode": "automatic",
      "automation_eligible": true,
      "sequence": 3,
      "priority": "P1",
      "slug": "/guida/regola-del-4-percento-swr",
      "working_title": "Regola del 4% e Safe Withdrawal Rate: significato e limiti",
      "cluster": "calcolo-fire",
      "parent_id": "GUIDE-0002",
      "search_intent": "Capire se e come usare la regola del 4% per pianificare i prelievi.",
      "primary_query": "regola del 4 percento FIRE",
      "secondary_queries": [
        "safe withdrawal rate Italia",
        "SWR FIRE",
        "prelievo sostenibile patrimonio"
      ],
      "reader_outcome": "Il lettore comprende origine, ipotesi, orizzonte e limiti del 4%, senza considerarlo una garanzia.",
      "unique_value": "Lettura critica dello SWR e confronto con durata FIRE, fiscalità e risorse future.",
      "simulator_features": [
        "SWR",
        "durata FIRE",
        "target FIRE"
      ],
      "source_focus": [
        "studi originali sui tassi di prelievo",
        "letteratura successiva",
        "metodologia del simulatore"
      ],
      "risk_level": "high",
      "freshness": "medium",
      "dependencies": [
        "METH-0001",
        "GUIDE-0001"
      ],
      "notes": "Non trasformare un tasso storico in promessa di successo futuro."
    },
    {
      "id": "GUIDE-0004",
      "content_type": "guide",
      "status": "pushed_to_main",
      "execution_mode": "automatic",
      "automation_eligible": true,
      "sequence": 4,
      "priority": "P1",
      "slug": "/guida/pac-per-raggiungere-il-fire",
      "working_title": "PAC per raggiungere il FIRE: capitale, tempo e versamenti",
      "cluster": "accumulo",
      "parent_id": "GUIDE-0001",
      "search_intent": "Stimare il versamento periodico necessario per raggiungere il target FIRE.",
      "primary_query": "PAC per raggiungere il FIRE",
      "secondary_queries": [
        "quanto investire al mese FIRE",
        "piano accumulo indipendenza finanziaria",
        "calcolo PAC FIRE"
      ],
      "reader_outcome": "Il lettore sa quali input determinano il PAC e come interpretarli senza confonderlo con un rendimento garantito.",
      "unique_value": "Esempi riproducibili con il calcolo mensile e il target del simulatore.",
      "simulator_features": [
        "PAC",
        "capitale attuale",
        "rendimento in accumulo",
        "età FIRE"
      ],
      "source_focus": [
        "metodologia del simulatore",
        "educazione finanziaria istituzionale",
        "formule di accumulo"
      ],
      "risk_level": "medium",
      "freshness": "low",
      "dependencies": [
        "METH-0001",
        "GUIDE-0001"
      ],
      "notes": null
    },
    {
      "id": "GUIDE-0005",
      "content_type": "guide",
      "status": "pushed_to_main",
      "execution_mode": "automatic",
      "automation_eligible": true,
      "sequence": 5,
      "priority": "P1",
      "slug": "/guida/inflazione-rendimenti-fire",
      "working_title": "Inflazione e rendimenti nel calcolo FIRE",
      "cluster": "ipotesi-finanziarie",
      "parent_id": "GUIDE-0002",
      "search_intent": "Capire come inflazione e rendimento cambiano capitale necessario e PAC.",
      "primary_query": "inflazione rendimento FIRE",
      "secondary_queries": [
        "inflazione indipendenza finanziaria",
        "rendimento atteso FIRE",
        "potere acquisto pensionamento anticipato"
      ],
      "reader_outcome": "Il lettore distingue gli effetti delle due variabili e sa provare scenari prudenti.",
      "unique_value": "Collegamento diretto tra ipotesi modificabili e risultati di accumulo e decumulo.",
      "simulator_features": [
        "inflazione",
        "rendimento FIRE",
        "rendimento accumulo",
        "proiezioni"
      ],
      "source_focus": [
        "ISTAT",
        "Banca d'Italia",
        "letteratura finanziaria",
        "metodologia del simulatore"
      ],
      "risk_level": "medium",
      "freshness": "medium",
      "dependencies": [
        "METH-0001",
        "GUIDE-0001"
      ],
      "notes": null
    },
    {
      "id": "GUIDE-0006",
      "content_type": "guide",
      "status": "pushed_to_main",
      "execution_mode": "automatic",
      "automation_eligible": true,
      "sequence": 6,
      "priority": "P1",
      "slug": "/guida/tassazione-fire-italia",
      "working_title": "Tassazione e FIRE in Italia: cosa considera il simulatore",
      "cluster": "fiscalita",
      "parent_id": "GUIDE-0001",
      "search_intent": "Comprendere come imposte e bollo incidono su accumulo e prelievi FIRE in Italia.",
      "primary_query": "tassazione FIRE Italia",
      "secondary_queries": [
        "tasse vivere di rendita Italia",
        "tassazione investimenti FIRE",
        "FIRE capital gain Italia"
      ],
      "reader_outcome": "Il lettore comprende il modello fiscale semplificato e riconosce ciò che richiede una valutazione personale.",
      "unique_value": "Spiegazione trasparente della fiscalità realmente modellata, inclusi bollo e plusvalenza latente.",
      "simulator_features": [